{
  "$schema": "https://json-schema.org/draft/2020-12/schema",
  "$id": "tenra-proxy.shape-external-output-request.v1",
  "title": "Proxy external output shape request",
  "type": "object",
  "additionalProperties": true,
  "required": [
    "clientApp",
    "surface",
    "profileId",
    "purpose",
    "draftText",
    "audience",
    "sourceArtifact",
    "traceId"
  ],
  "properties": {
    "clientApp": {
      "type": "string"
    },
    "surface": {
      "type": "string"
    },
    "profileId": {
      "type": "string"
    },
    "purpose": {
      "type": "string"
    },
    "draftText": {
      "type": "string"
    },
    "audience": {
      "type": "string"
    },
    "sourceArtifact": {
      "type": "object"
    },
    "hardConstraints": {
      "type": "array"
    },
    "traceId": {
      "type": "string"
    }
  },
  "x-tenra": {
    "ownerApp": "proxy",
    "producerApp": "source apps",
    "consumerApps": [
      "proxy"
    ],
    "fixture": "tenra Proxy/fixtures/handoffs/shape-external-output.json",
    "correlationFields": [
      "traceId"
    ],
    "standardControls": [
      "correlation id",
      "preview payload",
      "retry failed",
      "history"
    ]
  }
}
