{
  "clientApp": "partition",
  "surface": "operator-brief",
  "profileId": "profile:default",
  "purpose": "Explain a read-only lab validation request.",
  "draftText": "The lab request can be exported for disposable-image validation. Execution remains disabled.",
  "audience": "local operator",
  "sourceArtifact": {
    "schema": "tenra-partition.lab-validation-request.v1",
    "artifactId": "partition-demo-request",
    "exportedAt": "2026-05-06T17:30:00.000Z"
  },
  "hardConstraints": [
    "Use read-only language",
    "Keep destructive action locked"
  ],
  "traceId": "proxy-fixture-partition-operator-brief"
}
